source,date,text,rating,url
play_store,2026-06-18T01:22:02+00:00,AI slop..,1,https://play.google.com/store/apps/details?id=com.spotify.music
play_store,2026-06-18T01:20:37+00:00,your latest update killed the close screen widget on the Flip7,3,https://play.google.com/store/apps/details?id=com.spotify.music
play_store,2026-06-18T01:19:55+00:00,the GOAT,5,https://play.google.com/store/apps/details?id=com.spotify.music
play_store,2026-06-18T01:13:21+00:00,works like a champ use it all the time hook it to my rig Stereo and jam out,5,https://play.google.com/store/apps/details?id=com.spotify.music
play_store,2026-06-18T01:12:36+00:00,thank you for the consistent quality product,5,https://play.google.com/store/apps/details?id=com.spotify.music
play_store,2026-06-18T01:10:31+00:00,randomly stops letting me listen to the music i choose. at the worst times. just use youtube atp.,1,https://play.google.com/store/apps/details?id=com.spotify.music
play_store,2026-06-18T01:09:15+00:00,New widget sucks. Navigation is clunky. App works smoothly.,3,https://play.google.com/store/apps/details?id=com.spotify.music
play_store,2026-06-18T01:08:26+00:00,"never works idk how to fix it, ive tried uninstalling and reinstalling, clearing the cache, restarting my phone, but regardless, it doesnt work. sometimes music will play but I cant do anything cant skip a song or pause because it will crash. the music keeps playing after the app is closed. then awkwardly stops. when I try to open the app it takes forever if it even opens, idk how to fix it. I pay premium too, normally id use the Web version on my pc but I want to be able to use my phone",1,https://play.google.com/store/apps/details?id=com.spotify.music
play_store,2026-06-18T01:08:04+00:00,Getting 3 to 4 ads after only listening to 2 songs. Awful service,1,https://play.google.com/store/apps/details?id=com.spotify.music
play_store,2026-06-18T01:06:58+00:00,I wouldn't be without this gem in my life,5,https://play.google.com/store/apps/details?id=com.spotify.music
play_store,2026-06-18T01:06:15+00:00,way too many freaking ads ! so annoying. literally I get ads just when I open the app. Don't download if you are new.,1,https://play.google.com/store/apps/details?id=com.spotify.music
play_store,2026-06-18T00:59:41+00:00,Spotify is very good free listening app,5,https://play.google.com/store/apps/details?id=com.spotify.music
play_store,2026-06-18T00:57:55+00:00,remove the ai slop,1,https://play.google.com/store/apps/details?id=com.spotify.music
play_store,2026-06-18T00:57:54+00:00,I had to unsubscribe From my premium subscription And remove the app. I have Uninstalled and reinstalled multiple times to temporarily fix the problem For a few hours where It gives me a blank screen and refuses to work Or connect to my car After the recent update. I don't want to have an app where I have to Keep reinstalling it every day just to get it to work,1,https://play.google.com/store/apps/details?id=com.spotify.music
play_store,2026-06-18T00:57:52+00:00,An excellent app,5,https://play.google.com/store/apps/details?id=com.spotify.music
play_store,2026-06-18T00:54:26+00:00,"I bought a large storage phone so I could download all my liked songs for offline listening. the app will still refuse to work, when online, when offline. it will just freeze. been a subscriber since 2014 but I have no idea why the more I seem to use the app, the worse it works. It will be the only app running on my phone and still not be able to play a song. very very disappointing. I have lots of music I love on Spotify and love the access it gives, but this is horrible",1,https://play.google.com/store/apps/details?id=com.spotify.music
play_store,2026-06-18T00:54:05+00:00,I love the app but the ads I don't like it at all so please minimize it even it premium because people don't have money to use premium even if it 0.0 Gh¢ so please minimize the ads,5,https://play.google.com/store/apps/details?id=com.spotify.music
play_store,2026-06-18T00:53:05+00:00,old widget was better,1,https://play.google.com/store/apps/details?id=com.spotify.music
play_store,2026-06-18T00:52:09+00:00,"As of 6/17/2026, we are now forced to use the big widget instead of the smaller one. Changing my rating to a 1 star. Too many ads now, tells you here's a ½ hour of ad free play and plays an ad after the 1st or 2nd song. 80% of the time, when I skip a track, an ad comes on. Starting to be like all the other apps. Still not fixed as of 6/24/2025 & now we are forced to warch ads. can't search or anything. pauses as soon as you back out to search. Come on guys! This is getting more & more ridiculous",1,https://play.google.com/store/apps/details?id=com.spotify.music
play_store,2026-06-18T00:50:24+00:00,tried apple and Deezer but they don't come anywhere near close to Spotify . Annoyingly is the price per month - considerably more than other platforms.,5,https://play.google.com/store/apps/details?id=com.spotify.music
play_store,2026-06-18T00:48:49+00:00,excellent sounds,5,https://play.google.com/store/apps/details?id=com.spotify.music
play_store,2026-06-18T00:48:46+00:00,too much add,1,https://play.google.com/store/apps/details?id=com.spotify.music
play_store,2026-06-18T00:47:11+00:00,very nice and overall a good app!,5,https://play.google.com/store/apps/details?id=com.spotify.music
play_store,2026-06-18T00:46:08+00:00,good but u need internet for playlist,3,https://play.google.com/store/apps/details?id=com.spotify.music
play_store,2026-06-18T00:44:50+00:00,"Been using Spotify for well over 10 years and now I need to verify my age? Nevermind that I used a Student discount which requires college email, which one would need to be an adult to get. All very obnoxious and tedious.",1,https://play.google.com/store/apps/details?id=com.spotify.music
play_store,2026-06-18T00:43:03+00:00,I love the app but for some time now I have been unable to refresh recommended songs on my Playlist due to the search button blocking the refresh button Edit: it works now 👍,5,https://play.google.com/store/apps/details?id=com.spotify.music
play_store,2026-06-18T00:42:01+00:00,beaut.,5,https://play.google.com/store/apps/details?id=com.spotify.music
play_store,2026-06-18T00:41:49+00:00,"This app feels like it's made only for people who don't mind constant ads. The number of ads is frustrating. At this point, listening to FM radio feels better. The audio quality isn't even close to YouTube Music. To the Spotify Team, If you're pushing users this hard to buy Premium, why not just make Spotify a paid app? Please focus on improving the user experience instead of overwhelming free users with ads. Although the recommendation algorithm is very good.",1,https://play.google.com/store/apps/details?id=com.spotify.music
play_store,2026-06-18T00:41:07+00:00,premium is smooth,5,https://play.google.com/store/apps/details?id=com.spotify.music
play_store,2026-06-18T00:39:55+00:00,Please add back the widget that only takes up 1 row.,1,https://play.google.com/store/apps/details?id=com.spotify.music
play_store,2026-06-18T00:37:23+00:00,Its hard to get to the songs I want. but the songs that I run into are just as tasteful,4,https://play.google.com/store/apps/details?id=com.spotify.music
play_store,2026-06-18T00:36:19+00:00,Estoy a punto de pausar o cancelar mi suscripción. ya tengo tiempo batallando con la app . se pausa la música. si busco una canción y le quiero dar play se pone la misma que ya estaba escuchando. tiene muchos bugs,2,https://play.google.com/store/apps/details?id=com.spotify.music
play_store,2026-06-18T00:34:34+00:00,It is an annoying but I think the adds are to much because you can be playing a song and an add will come it is very annoying,4,https://play.google.com/store/apps/details?id=com.spotify.music
play_store,2026-06-18T00:33:23+00:00,I love Spotify,5,https://play.google.com/store/apps/details?id=com.spotify.music
play_store,2026-06-18T00:31:26+00:00,peak,5,https://play.google.com/store/apps/details?id=com.spotify.music
play_store,2026-06-18T00:28:46+00:00,The best audio platform,5,https://play.google.com/store/apps/details?id=com.spotify.music
play_store,2026-06-18T00:27:23+00:00,I love the app,5,https://play.google.com/store/apps/details?id=com.spotify.music
play_store,2026-06-18T00:26:38+00:00,super for music 🎶,5,https://play.google.com/store/apps/details?id=com.spotify.music
play_store,2026-06-18T00:18:36+00:00,only ad ad,1,https://play.google.com/store/apps/details?id=com.spotify.music
play_store,2026-06-18T00:17:08+00:00,life changing and affirming,5,https://play.google.com/store/apps/details?id=com.spotify.music
play_store,2026-06-18T00:16:11+00:00,new android widget is rubbish and doesn't work properly.,1,https://play.google.com/store/apps/details?id=com.spotify.music
play_store,2026-06-18T00:14:10+00:00,Great app for listening music,5,https://play.google.com/store/apps/details?id=com.spotify.music
play_store,2026-06-18T00:12:19+00:00,"another redesign nobody asked for. ""improved"" android widget now takes up twice the space for no additional functionality, and now can't even display the full name of a song. are you trying to drive us back to buying CDs again or what?",1,https://play.google.com/store/apps/details?id=com.spotify.music
play_store,2026-06-18T00:12:02+00:00,why are there soo much ads!!!,1,https://play.google.com/store/apps/details?id=com.spotify.music
play_store,2026-06-18T00:09:53+00:00,"my subscription drastically changed from premium to premium lite for no reason *edit, great consultation, everything got resolved",4,https://play.google.com/store/apps/details?id=com.spotify.music
play_store,2026-06-18T00:09:50+00:00,The best there is,5,https://play.google.com/store/apps/details?id=com.spotify.music
play_store,2026-06-18T00:07:59+00:00,the monthly subscription rate is too much for what you get. tech support is always disappointing except maybe once. the App needs a revamp and freshen up. Pandora seems more attractive may not have enough music as Spotify but the help and tech support are better,3,https://play.google.com/store/apps/details?id=com.spotify.music
play_store,2026-06-18T00:06:36+00:00,Spotify is the best part of my music journey. discovering Spotify and play it by our mood. I can say it's perfect. ☺,5,https://play.google.com/store/apps/details?id=com.spotify.music
play_store,2026-06-18T00:00:31+00:00,"made my dreams True . Always had to find my favorite tracks,converting them to MP3 and collecting in a flash drive to play them as collection in the car.now without all these hassles I have several collections. but not happy with their high price. 😒",4,https://play.google.com/store/apps/details?id=com.spotify.music
play_store,2026-06-18T00:00:25+00:00,"very good app, I love it.",5,https://play.google.com/store/apps/details?id=com.spotify.music
play_store,2026-06-17T23:57:45+00:00,extra ordinary,5,https://play.google.com/store/apps/details?id=com.spotify.music
play_store,2026-06-17T23:57:32+00:00,tuff,5,https://play.google.com/store/apps/details?id=com.spotify.music
play_store,2026-06-17T23:57:14+00:00,ότι καλύτερο,5,https://play.google.com/store/apps/details?id=com.spotify.music
play_store,2026-06-17T23:56:02+00:00,the best music,5,https://play.google.com/store/apps/details?id=com.spotify.music
play_store,2026-06-17T23:47:17+00:00,it's okay it's good it's just now I have to pay to listen to music??? what happened to be free 😭😭🥀🥀🥀,3,https://play.google.com/store/apps/details?id=com.spotify.music
play_store,2026-06-17T23:45:38+00:00,so interested,5,https://play.google.com/store/apps/details?id=com.spotify.music
play_store,2026-06-17T23:45:30+00:00,after all this time no landscape option for Spotify. this will remain a 1 star until they add it. ridiculous to not have after all this time.,1,https://play.google.com/store/apps/details?id=com.spotify.music
play_store,2026-06-17T23:41:36+00:00,Love all the music options,5,https://play.google.com/store/apps/details?id=com.spotify.music
play_store,2026-06-17T23:41:00+00:00,When I use headphone it just let me feel like I am heaven,5,https://play.google.com/store/apps/details?id=com.spotify.music
play_store,2026-06-17T23:35:58+00:00,"Mostly benefits for premium members, not common users,so uninstalled this app. Personally, I won't recommend this app for music too many adds",1,https://play.google.com/store/apps/details?id=com.spotify.music
play_store,2026-06-17T23:35:51+00:00,I love it so much i think u should use it if u love songs,5,https://play.google.com/store/apps/details?id=com.spotify.music
play_store,2026-06-17T23:33:39+00:00,I didn't like it because it always says that to upgrade to premium,1,https://play.google.com/store/apps/details?id=com.spotify.music
play_store,2026-06-17T23:33:15+00:00,cause the songs and the playlists are so PERRFECTO!!🤪🤙,5,https://play.google.com/store/apps/details?id=com.spotify.music
play_store,2026-06-17T23:29:21+00:00,"The app is good, but the subscription cost is too high. We used the old Family Plan that supported up to 6 people for around ₹230–₹240, which was much more reasonable. Now the Standard plan costs ₹139 for a single user. For just ₹10 more, I can get YouTube Premium at ₹149, which includes ad-free videos and YouTube Music Premium. Compared to that, Spotify doesn't feel worth the price anymore.",1,https://play.google.com/store/apps/details?id=com.spotify.music
play_store,2026-06-17T23:27:04+00:00,"New widgets SUCK. I don't need an extra 4x1 taken up on my home screen for your recommendations. I know what I want to listen to, and if I do happen to want a recommendation, I can open the app and get them whenever I want. Please put user experience over your desires to psychologically and subconsciously push people into increase usage of your app, and restore the option of the 4x1 widget.",1,https://play.google.com/store/apps/details?id=com.spotify.music
play_store,2026-06-17T23:25:11+00:00,"Im in a family abo and everytime i launch spotify on my phone its very buggy and crashing a lot. Downloaded Songs sometimes undownload(?) themselves, when i dont have Internet they are grayed out making the App pretty useless...",1,https://play.google.com/store/apps/details?id=com.spotify.music
play_store,2026-06-17T23:24:57+00:00,musice quality is good,5,https://play.google.com/store/apps/details?id=com.spotify.music
play_store,2026-06-17T23:24:14+00:00,There Great 👍,5,https://play.google.com/store/apps/details?id=com.spotify.music
play_store,2026-06-17T23:22:45+00:00,do sabdo mai bolu toh bakwas app hai isse achha mai radio mai song sun lu,1,https://play.google.com/store/apps/details?id=com.spotify.music
play_store,2026-06-17T23:21:19+00:00,because if you go out and play song on YouTube youtube will be closed or any app accept Spotify that's why I like Spotify to much,5,https://play.google.com/store/apps/details?id=com.spotify.music
play_store,2026-06-17T23:20:24+00:00,greedy in my opinon,1,https://play.google.com/store/apps/details?id=com.spotify.music
play_store,2026-06-17T23:19:41+00:00,trash,1,https://play.google.com/store/apps/details?id=com.spotify.music
play_store,2026-06-17T23:19:24+00:00,it's amazing app for listening music... whenever I want to listen music i have come on this app and listen music what i want to listen.... you can also install this app guy's if you are interested in listening music 🎵🎶😀,5,https://play.google.com/store/apps/details?id=com.spotify.music
play_store,2026-06-17T23:17:16+00:00,best app ever,5,https://play.google.com/store/apps/details?id=com.spotify.music
play_store,2026-06-17T23:16:39+00:00,goated,5,https://play.google.com/store/apps/details?id=com.spotify.music
play_store,2026-06-17T23:15:42+00:00,Bring back the old widget. (June 2026),1,https://play.google.com/store/apps/details?id=com.spotify.music
play_store,2026-06-17T23:14:06+00:00,being forced to use the new widget that takes double the space sucks. i want the single line widget and cant even use it anymore... how stupid. 2 stars.,2,https://play.google.com/store/apps/details?id=com.spotify.music
play_store,2026-06-17T23:12:25+00:00,the Best music app,5,https://play.google.com/store/apps/details?id=com.spotify.music
play_store,2026-06-17T23:11:11+00:00,nice Spotify and music voice🤌🏻,5,https://play.google.com/store/apps/details?id=com.spotify.music
play_store,2026-06-17T23:10:20+00:00,"best music app hands down, though ads are really annoying 😑",4,https://play.google.com/store/apps/details?id=com.spotify.music
play_store,2026-06-17T23:09:16+00:00,very nice very good experience in Spotify,5,https://play.google.com/store/apps/details?id=com.spotify.music
play_store,2026-06-17T23:05:49+00:00,"they ditched the original widget and the replacement is hot garbage. whatever your listening to, it will only show the newest episode of the show in the widget and not where you left off like the old version. missing buttons, ugly design. I don't know how some of these updates get approved... someone's boss must have been on PTO...",2,https://play.google.com/store/apps/details?id=com.spotify.music
play_store,2026-06-17T23:05:09+00:00,"dear spotify: I so NOT want a 4x2 widget. since you've killed the 4x1 widget, you just won't be on my homepage or used often anymore. this will lead to cancelation of a long term customer.",1,https://play.google.com/store/apps/details?id=com.spotify.music
play_store,2026-06-17T23:03:18+00:00,great app,5,https://play.google.com/store/apps/details?id=com.spotify.music
play_store,2026-06-17T23:02:56+00:00,verygood,4,https://play.google.com/store/apps/details?id=com.spotify.music
play_store,2026-06-17T22:57:37+00:00,very excellent for listening.,5,https://play.google.com/store/apps/details?id=com.spotify.music
play_store,2026-06-17T22:56:03+00:00,ok didn't really use it I had a free trial and didn't use it enough,3,https://play.google.com/store/apps/details?id=com.spotify.music
play_store,2026-06-17T22:54:13+00:00,Love it This is the 2nd or 3rd time that I've had to uninstall the app because it keeps messing up,5,https://play.google.com/store/apps/details?id=com.spotify.music
play_store,2026-06-17T22:52:33+00:00,please stop this feature which is we cannot play specific part of song and we got only 6 skips per hour and we cannot select any music please remove all of these features why you are doing this please remove🙏🙏🥺🥺😡,1,https://play.google.com/store/apps/details?id=com.spotify.music
play_store,2026-06-17T22:45:12+00:00,this app is so good with best quality 👍,5,https://play.google.com/store/apps/details?id=com.spotify.music
play_store,2026-06-17T22:44:13+00:00,Earlier version was good,1,https://play.google.com/store/apps/details?id=com.spotify.music
play_store,2026-06-17T22:43:20+00:00,it's perfect,5,https://play.google.com/store/apps/details?id=com.spotify.music
play_store,2026-06-17T22:43:06+00:00,is now having me confirm my age after I have been on the app since 2020,3,https://play.google.com/store/apps/details?id=com.spotify.music
play_store,2026-06-17T22:37:31+00:00,"Used it for years but the minutes of ads as soon as I play anything is ridiculous, and now I get an ad before every single song. I actually had to delete the app to get it to stop playing ads as soon as my car started.",1,https://play.google.com/store/apps/details?id=com.spotify.music
play_store,2026-06-17T22:36:10+00:00,v gud,5,https://play.google.com/store/apps/details?id=com.spotify.music
play_store,2026-06-17T22:32:59+00:00,I love this app,5,https://play.google.com/store/apps/details?id=com.spotify.music
play_store,2026-06-17T22:28:24+00:00,best app but adds 🤮,5,https://play.google.com/store/apps/details?id=com.spotify.music
play_store,2026-06-17T22:28:15+00:00,"Tem propagandas em um app que eu pago???? Mas que abuso com o consumidor heim? Meus podcasts são interrompidos com anúncios muitas vezes. Os anúncios não são no começo ou final dos episódios, são no decorrer dele.",1,https://play.google.com/store/apps/details?id=com.spotify.music
play_store,2026-06-17T22:23:29+00:00,"This is edited from my original rant of the ad problem on Spotify and it's so much worse, now you get an Ad every single time you OPEN THE APP. Basically every song is ad on ad on ad and I don't seem to even get 15+ minute ad breaks anymore. It's as if you can't listen to music without purchasing Premium which is such a let down compared to older Spotify, even a couple years ago it wasn't as much of a major problem. Disappointing.",1,https://play.google.com/store/apps/details?id=com.spotify.music
play_store,2026-06-17T22:22:33+00:00,you can listen to music while gaming,5,https://play.google.com/store/apps/details?id=com.spotify.music
play_store,2026-06-17T22:20:28+00:00,great way to enjoy your own favorite music,5,https://play.google.com/store/apps/details?id=com.spotify.music
play_store,2026-06-17T22:20:03+00:00,amezing,5,https://play.google.com/store/apps/details?id=com.spotify.music
play_store,2026-06-17T22:19:17+00:00,AWSOME,5,https://play.google.com/store/apps/details?id=com.spotify.music
play_store,2026-06-17T22:19:13+00:00,because this app has a limit for only 6 songs to skip per day and this is not worth it and have more ads on this app while listening to the music it feels like irritating but user interface is better,2,https://play.google.com/store/apps/details?id=com.spotify.music
play_store,2026-06-17T22:18:13+00:00,I like it but the ads are way to long,4,https://play.google.com/store/apps/details?id=com.spotify.music
play_store,2026-06-17T22:16:25+00:00,I can't explains in word and the rest is history leave it behind keep it up Spotify 😗,5,https://play.google.com/store/apps/details?id=com.spotify.music
play_store,2026-06-17T22:14:09+00:00,"HATE THE NEW WIDGET!!! Bring back the regular now playing widget, at least give us the option!!! I don't want suggestions, I just want a *simple* now-playing widget.",1,https://play.google.com/store/apps/details?id=com.spotify.music
play_store,2026-06-17T22:13:48+00:00,please remove ads🙏,1,https://play.google.com/store/apps/details?id=com.spotify.music
play_store,2026-06-17T22:12:52+00:00,why is it all of a sudden there are issues with the platform. today I can click on any Playlist ... akd as soon as that song is done it changes to a COMPLETELY different style of music. and ill go back to the playlist puk another song and again when its done it changes to something else,2,https://play.google.com/store/apps/details?id=com.spotify.music
play_store,2026-06-17T22:12:44+00:00,SO MANY UNSKIPPABLE LONGLASTING ADDS,1,https://play.google.com/store/apps/details?id=com.spotify.music
play_store,2026-06-17T22:10:42+00:00,"Absolute trash. New widget broke the already broken app more. Recommendations are always yhe exact same song (regardless of what you're listening to), the shuffle works the same way (only plays the same couple soungs). Its a free app for me and I still would rather listen to music on YouTube with commercials",1,https://play.google.com/store/apps/details?id=com.spotify.music
play_store,2026-06-17T22:05:48+00:00,exceptional,5,https://play.google.com/store/apps/details?id=com.spotify.music
play_store,2026-06-17T22:04:22+00:00,saya dapat dengar lagu yang saya suka,5,https://play.google.com/store/apps/details?id=com.spotify.music
play_store,2026-06-17T22:00:09+00:00,"literally, so many songs are hacked, its terrible, I know its the hacker's fault but like.. Whats wrong with yer digital security..",2,https://play.google.com/store/apps/details?id=com.spotify.music
play_store,2026-06-17T21:59:57+00:00,"so unfair limit 6 skip per hour and there is limit to listen new music, so baddd",1,https://play.google.com/store/apps/details?id=com.spotify.music
play_store,2026-06-17T21:59:23+00:00,i like it so much 😁❤️,5,https://play.google.com/store/apps/details?id=com.spotify.music
play_store,2026-06-17T21:58:36+00:00,Worst music app ever and it's getting worse day by day,5,https://play.google.com/store/apps/details?id=com.spotify.music
play_store,2026-06-17T21:58:25+00:00,great experience. with Spotify vibe with me #justice for sidhu moosewala,5,https://play.google.com/store/apps/details?id=com.spotify.music
play_store,2026-06-17T21:58:22+00:00,Why am I being forced to use a 4x2 widget? The 4x1 widget is the perfect layout. A music widget does not need to take up that much screen space. Y'all really want me to go to Tidal don't you.,1,https://play.google.com/store/apps/details?id=com.spotify.music
play_store,2026-06-17T21:56:51+00:00,my go to app everytime i want to listen to song while using another app. i purchase for premium so there's no ad disturbing,5,https://play.google.com/store/apps/details?id=com.spotify.music
play_store,2026-06-17T21:55:58+00:00,the audio ummmm best and it has blackpink main reason yeahhhhhhhhhh,5,https://play.google.com/store/apps/details?id=com.spotify.music
play_store,2026-06-17T21:55:09+00:00,"thank you for making me deaf. Do you not like unpaid people? Cuz I've been fine with the ads back in the days. But 4 ADS??? Waste of minutes, especially the ""buy premium"" ads, i rarely heard other ads now. heard that hundred of times. The ads is LOUD. I was trying to listen a calm soothing song then suddenly? BIG LOUD ADS just screaming at my ears. It's annoying. Edit: yk what I give up. idc.",1,https://play.google.com/store/apps/details?id=com.spotify.music
play_store,2026-06-17T21:54:49+00:00,it's strange but since the last update my nothing phone 4a is shown as a tablet it's really strange but it doesn't change the experience that's still great just a bit sad that the update just broke this like why would my nothing phone 4a become a tablet ?,5,https://play.google.com/store/apps/details?id=com.spotify.music
