source,date,text,rating,url
play_store,2026-06-18T15:42:01+00:00,"what's going on? This past month I keep having to uninstall and reinstall just to use the app, it's been o.e a daily activity now... Is it my phone or Spotify?!",2,https://play.google.com/store/apps/details?id=com.spotify.music
play_store,2026-06-18T15:40:37+00:00,Easy to use. Great suggestions.,5,https://play.google.com/store/apps/details?id=com.spotify.music
play_store,2026-06-18T15:38:40+00:00,"I love the app, as always. However, in my Xiaomi 17 Pro Max the new widget doesn't appear, I can't find it in the widget list (I do find the old widget) and the notifications that you put in the app to add the widget also didn't work (I even tried to find it in settings, both in Spotify app and cellphone). And now you disabled the old widget. And Google Maps navigation integration is also not working. And offline (bluetooth only) jams would be amazing for car trips.",4,https://play.google.com/store/apps/details?id=com.spotify.music
play_store,2026-06-18T15:31:29+00:00,"Been using this for YEARS, it's pretty epic, cool and awesome but what a shame I don't have premium lol",5,https://play.google.com/store/apps/details?id=com.spotify.music
play_store,2026-06-18T15:29:24+00:00,l like AAP,5,https://play.google.com/store/apps/details?id=com.spotify.music
play_store,2026-06-18T15:25:58+00:00,best player in Pakistan,2,https://play.google.com/store/apps/details?id=com.spotify.music
play_store,2026-06-18T15:22:45+00:00,when I lisen hanuman ji song single song after no one song available continue to hanuman bhajan amend it then we will give 5 star.,2,https://play.google.com/store/apps/details?id=com.spotify.music
play_store,2026-06-18T15:21:41+00:00,"App works great, the Roku app has some problems opening cleanly and consistently which is a shame for how much I use it",4,https://play.google.com/store/apps/details?id=com.spotify.music
play_store,2026-06-18T15:21:34+00:00,It's great trust me✨,5,https://play.google.com/store/apps/details?id=com.spotify.music
play_store,2026-06-18T15:20:15+00:00,I can't hear any songs because it's premium but just for a month that's half my salary what is this app YT music is better. UNINSTALLED,1,https://play.google.com/store/apps/details?id=com.spotify.music
play_store,2026-06-18T15:20:02+00:00,"We non premium listener hear plenty of ads, minutes at most, it's disruptive, repetetive, and annoying. Atleast make the selection of music unlimited it's the least you can do. If i discover other app that offers free music with free selection of music, I will replace this app with no hesitation. And of course you don't care even though you make a lot of money just us listening to the ads you make us listen",1,https://play.google.com/store/apps/details?id=com.spotify.music
play_store,2026-06-18T15:19:47+00:00,nice work 👍,5,https://play.google.com/store/apps/details?id=com.spotify.music
play_store,2026-06-18T15:19:24+00:00,immaculant,5,https://play.google.com/store/apps/details?id=com.spotify.music
play_store,2026-06-18T15:14:52+00:00,"Got too expensive, used to be my daily driver but now I'm using apple music. Same service at a cheaper cost.",2,https://play.google.com/store/apps/details?id=com.spotify.music
play_store,2026-06-18T15:11:55+00:00,very good 👍,5,https://play.google.com/store/apps/details?id=com.spotify.music
play_store,2026-06-18T15:11:18+00:00,lt's wonderful,5,https://play.google.com/store/apps/details?id=com.spotify.music
play_store,2026-06-18T15:07:52+00:00,will steal ur money and not give u ur subscription,1,https://play.google.com/store/apps/details?id=com.spotify.music
play_store,2026-06-18T15:05:47+00:00,too many ads in between music 😞 ads kills the vibes 😔 too obsessed with this app,2,https://play.google.com/store/apps/details?id=com.spotify.music
play_store,2026-06-18T15:05:46+00:00,all was asking primiem lisning very badddddddd👿👿👿👿,1,https://play.google.com/store/apps/details?id=com.spotify.music
play_store,2026-06-18T14:59:32+00:00,not f2p friendly,1,https://play.google.com/store/apps/details?id=com.spotify.music
play_store,2026-06-18T14:58:10+00:00,they really want you to get premium and if not ur gonna be at a big disadvantage like not having songs play in ur playlist and insert they do similar songs,3,https://play.google.com/store/apps/details?id=com.spotify.music
play_store,2026-06-18T14:57:58+00:00,Nice platform,5,https://play.google.com/store/apps/details?id=com.spotify.music
play_store,2026-06-18T14:57:28+00:00,stop forcing new widgit,1,https://play.google.com/store/apps/details?id=com.spotify.music
play_store,2026-06-18T14:55:17+00:00,it's cool love the songs you added Spotify,4,https://play.google.com/store/apps/details?id=com.spotify.music
play_store,2026-06-18T14:55:01+00:00,this app does not deserve one star,1,https://play.google.com/store/apps/details?id=com.spotify.music
play_store,2026-06-18T14:54:34+00:00,I don't know what to say.. but If these ads come back again and again.. I will start downloading songs from other platforms,1,https://play.google.com/store/apps/details?id=com.spotify.music
play_store,2026-06-18T14:49:17+00:00,Removed perfectly functional widget for one that doesn't work whatsoever. Don't waste your money.,1,https://play.google.com/store/apps/details?id=com.spotify.music
play_store,2026-06-18T14:45:55+00:00,I LOVE THIS APP 😊😁❣️🤍,5,https://play.google.com/store/apps/details?id=com.spotify.music
play_store,2026-06-18T14:42:16+00:00,i lik I like it,5,https://play.google.com/store/apps/details?id=com.spotify.music
play_store,2026-06-18T14:40:51+00:00,supra assom,1,https://play.google.com/store/apps/details?id=com.spotify.music
play_store,2026-06-18T14:38:53+00:00,"Very disappointing experience. The app shows too many ads. When listening to songs, two ads play before the music starts and more ads appear after the song ends. It completely ruins the listening experience. Ads are understandable in a free version, but this amount of interruption is too much. Please reduce the number of ads and improve the user experience. 🤬😡😡😡",1,https://play.google.com/store/apps/details?id=com.spotify.music
play_store,2026-06-18T14:37:52+00:00,Best Music App,5,https://play.google.com/store/apps/details?id=com.spotify.music
play_store,2026-06-18T14:37:21+00:00,"As a Spotify premium user, I don't have much to complain about. But, the one thing that made me rate this 2-stars (hopefully, y'all need to take such feedback very seriously) is the ""shuffle"" algorithm. It is VERY DISAPPOINTING! I left Spotify for almost 2 years and recently decided to go back to it and this made me remember why I left the app. Having 206 songs in a playlist and Spotify ""shuffle-play"" decides, that playing the same 23 songs is a good thing ??😤 Y'ALL NEED TO DO BETTER!",2,https://play.google.com/store/apps/details?id=com.spotify.music
play_store,2026-06-18T14:33:25+00:00,Best app of music,5,https://play.google.com/store/apps/details?id=com.spotify.music
play_store,2026-06-18T14:32:41+00:00,it doesn't allow me to choose songs without premium and i cant skip a song this has to be fixed pls and thank u,1,https://play.google.com/store/apps/details?id=com.spotify.music
play_store,2026-06-18T14:31:55+00:00,one of the best music platform,5,https://play.google.com/store/apps/details?id=com.spotify.music
play_store,2026-06-18T14:30:16+00:00,top music algorithm,5,https://play.google.com/store/apps/details?id=com.spotify.music
play_store,2026-06-18T14:26:46+00:00,"It being trash, day by day,... Wort experience, spotify ❌ spotiadds ✅",1,https://play.google.com/store/apps/details?id=com.spotify.music
play_store,2026-06-18T14:25:17+00:00,download becoming a premium 🙃🤮,1,https://play.google.com/store/apps/details?id=com.spotify.music
play_store,2026-06-18T14:22:50+00:00,"it's add is gross,specially if u trying to move from playlist to another",1,https://play.google.com/store/apps/details?id=com.spotify.music
play_store,2026-06-18T14:20:45+00:00,simplicity,5,https://play.google.com/store/apps/details?id=com.spotify.music
play_store,2026-06-18T14:14:44+00:00,"be for real, they need premium just to download a song? you can't even make re-tag the music, this update is piss me off, and they added many add, and they added something that you can play only one song. only one, and play tomorrow 😒. I suggest remove the limitations and adds.",1,https://play.google.com/store/apps/details?id=com.spotify.music
play_store,2026-06-18T14:13:00+00:00,The new update has ruined everything!,1,https://play.google.com/store/apps/details?id=com.spotify.music
play_store,2026-06-18T14:09:22+00:00,Good Songs of famous Singers,5,https://play.google.com/store/apps/details?id=com.spotify.music
play_store,2026-06-18T14:08:57+00:00,They are the best,5,https://play.google.com/store/apps/details?id=com.spotify.music
play_store,2026-06-18T14:08:16+00:00,grateful,5,https://play.google.com/store/apps/details?id=com.spotify.music
play_store,2026-06-18T14:07:57+00:00,good job,5,https://play.google.com/store/apps/details?id=com.spotify.music
play_store,2026-06-18T14:07:02+00:00,all is ok except spotline vijay . not only me my friend also hate him,3,https://play.google.com/store/apps/details?id=com.spotify.music
play_store,2026-06-18T14:04:01+00:00,Best of the best,5,https://play.google.com/store/apps/details?id=com.spotify.music
play_store,2026-06-18T13:55:54+00:00,"imma be real,THIS APP IS AMAZING THE ADS ARE LIKE 4 TIMES wich can be very onnaying BUT ITS SAVES SOME TIME!! if i go to the bathroom and the ads are playing,i wont have to press on the song! but sorry i wont buy premium( ´-｀) sooooo yeah all from me(^з^)-☆!",5,https://play.google.com/store/apps/details?id=com.spotify.music
play_store,2026-06-18T13:52:35+00:00,best music app. only problem is ad,5,https://play.google.com/store/apps/details?id=com.spotify.music
play_store,2026-06-18T13:50:32+00:00,"It makes me calm everytime when I opened this app, sometimes I listened to it before sleep",5,https://play.google.com/store/apps/details?id=com.spotify.music
play_store,2026-06-18T13:50:22+00:00,good just chose what song next,4,https://play.google.com/store/apps/details?id=com.spotify.music
play_store,2026-06-18T13:49:00+00:00,so nice,5,https://play.google.com/store/apps/details?id=com.spotify.music
play_store,2026-06-18T13:46:35+00:00,good keep it on ❤️,5,https://play.google.com/store/apps/details?id=com.spotify.music
play_store,2026-06-18T13:45:25+00:00,here are too many adand they ruin my mood and the vibe,3,https://play.google.com/store/apps/details?id=com.spotify.music
play_store,2026-06-18T13:44:22+00:00,its like average not good at all and can't be the best cz it's saying to get premium for like every single little thing and I hate that . The app is good but it would be better if they js stop saying to take premium for everything little thing. 😠,3,https://play.google.com/store/apps/details?id=com.spotify.music
play_store,2026-06-18T13:39:19+00:00,"I absolutely love Spotify, the offline Playlist that is made out of videos I haven't downloaded but can still listen to is absolutely the BEST!",5,https://play.google.com/store/apps/details?id=com.spotify.music
play_store,2026-06-18T13:38:58+00:00,it is a good music app but it have ads without premium but now the ad's system is improved and we do not get ads for 30 minutes,4,https://play.google.com/store/apps/details?id=com.spotify.music
play_store,2026-06-18T13:38:43+00:00,good app man,5,https://play.google.com/store/apps/details?id=com.spotify.music
play_store,2026-06-18T13:38:03+00:00,greedy,1,https://play.google.com/store/apps/details?id=com.spotify.music
play_store,2026-06-18T13:37:24+00:00,Too much add,3,https://play.google.com/store/apps/details?id=com.spotify.music
play_store,2026-06-18T13:37:06+00:00,i get 3 ads per song thats insane,1,https://play.google.com/store/apps/details?id=com.spotify.music
play_store,2026-06-18T13:36:38+00:00,"too many advertisements, it's playing song after 4 advertisements, youtube is better than this.",2,https://play.google.com/store/apps/details?id=com.spotify.music
play_store,2026-06-18T13:35:52+00:00,best app for listening music 🎧 🎶 🎵 👌 🙌 😌,5,https://play.google.com/store/apps/details?id=com.spotify.music
play_store,2026-06-18T13:35:47+00:00,"Switching soon. Getting rid of ""liked songs"" playlist was the breaking point. They keep changing to the ""improved"" UI, give people a choice as to what UI they want to use. Forcing me to use the glitchy garbage 4x2 widget instead of the 4x1 that worked fine was the last straw. Done paying for this garbage.",1,https://play.google.com/store/apps/details?id=com.spotify.music
play_store,2026-06-18T13:35:42+00:00,ok,5,https://play.google.com/store/apps/details?id=com.spotify.music
play_store,2026-06-18T13:32:26+00:00,too many ads and for every action premium needed,2,https://play.google.com/store/apps/details?id=com.spotify.music
play_store,2026-06-18T13:30:47+00:00,love easy to find what you're looking for,5,https://play.google.com/store/apps/details?id=com.spotify.music
play_store,2026-06-18T13:28:12+00:00,beast aap,5,https://play.google.com/store/apps/details?id=com.spotify.music
play_store,2026-06-18T13:21:13+00:00,I LOVE THIS,5,https://play.google.com/store/apps/details?id=com.spotify.music
play_store,2026-06-18T13:20:47+00:00,just ads ads and ads,1,https://play.google.com/store/apps/details?id=com.spotify.music
play_store,2026-06-18T13:17:10+00:00,this app help me a lot when I'm in pain or lonely or bored 💖💖💖,5,https://play.google.com/store/apps/details?id=com.spotify.music
play_store,2026-06-18T13:16:39+00:00,search karta hun kuchh aur hi a jata hai koi bhi download mat Karna jiska purana phone ho to bilkul hi mat karna,1,https://play.google.com/store/apps/details?id=com.spotify.music
play_store,2026-06-18T13:16:02+00:00,i like that but it have a problem that a playlist will not play in a sequence of songs in it,4,https://play.google.com/store/apps/details?id=com.spotify.music
play_store,2026-06-18T13:15:15+00:00,It's easy to find what you want to listen to and there's a lot of great music on here. Would definitely recommend.,5,https://play.google.com/store/apps/details?id=com.spotify.music
play_store,2026-06-18T13:13:20+00:00,best ❤️❤️,5,https://play.google.com/store/apps/details?id=com.spotify.music
play_store,2026-06-18T13:12:27+00:00,Free version= Dustbin,1,https://play.google.com/store/apps/details?id=com.spotify.music
play_store,2026-06-18T13:10:40+00:00,"I love this app, it always provide new songs. 5 star for spotify",5,https://play.google.com/store/apps/details?id=com.spotify.music
play_store,2026-06-18T13:10:04+00:00,🖤💫,5,https://play.google.com/store/apps/details?id=com.spotify.music
play_store,2026-06-18T13:09:53+00:00,not bad💯 ads though 👀,5,https://play.google.com/store/apps/details?id=com.spotify.music
play_store,2026-06-18T13:07:08+00:00,I love this app it's just that u will need to pay to listen to the songs u want. it will only happen if you play Spotify for awhile,4,https://play.google.com/store/apps/details?id=com.spotify.music
play_store,2026-06-18T13:06:11+00:00,toooooo muchhhh adddddd,1,https://play.google.com/store/apps/details?id=com.spotify.music
play_store,2026-06-18T13:05:34+00:00,Brings so much happiness. Thank you.,5,https://play.google.com/store/apps/details?id=com.spotify.music
play_store,2026-06-18T13:01:22+00:00,why tf did y'all take of free mobility of us listening to songs,2,https://play.google.com/store/apps/details?id=com.spotify.music
play_store,2026-06-18T13:00:52+00:00,very good song,5,https://play.google.com/store/apps/details?id=com.spotify.music
play_store,2026-06-18T12:59:41+00:00,when I listen songs so song doesn't start play instead ads come after every singel song so disgusting 🙂,1,https://play.google.com/store/apps/details?id=com.spotify.music
play_store,2026-06-18T12:59:17+00:00,vibe,5,https://play.google.com/store/apps/details?id=com.spotify.music
play_store,2026-06-18T12:58:33+00:00,I love this app before yt music I love Spotify cuz it's song can stay if we remove the tab or smth🥰🥰 But pls remove premium pls🥰🥰🙏🏻,3,https://play.google.com/store/apps/details?id=com.spotify.music
play_store,2026-06-18T12:56:00+00:00,"una feel say person dey pluck money from tree bah?? I pay for premium, I was debited on the 2nd of June or so. At just June 15th or there about, una dey talk say payment failed, like una wan debit me again?? I decided to just cancel the subscription. Normally, if you cancel subscription, you'll be able to use it for the rest of the month but noooooo. As I cancelled the subscription, una nor waste time, una jejely kick me out. Make una sufree oh 😠😠",1,https://play.google.com/store/apps/details?id=com.spotify.music
play_store,2026-06-18T12:54:42+00:00,since i knew this app i dont have to worri about not knowing the titel of a paticuler song i come acros,5,https://play.google.com/store/apps/details?id=com.spotify.music
play_store,2026-06-18T12:54:21+00:00,Premium Plan is affordable and Worth purchasing if you don't want ads and limitations.,4,https://play.google.com/store/apps/details?id=com.spotify.music
play_store,2026-06-18T12:54:08+00:00,the app is right to hear music but the music app is installing slowly I don't want too many verifications I just want to touch the app and have to hear music identify creations and so many so I don't want any verification that and this,3,https://play.google.com/store/apps/details?id=com.spotify.music
play_store,2026-06-18T12:52:43+00:00,Mast hai yaar Maja aa jata is app par song sun kar aur sab Mast bhot badhiya hai,5,https://play.google.com/store/apps/details?id=com.spotify.music
play_store,2026-06-18T12:51:59+00:00,Agar har ek cheez pe charge issue karoge to koi bhi isse aap ko use nahi karenge,2,https://play.google.com/store/apps/details?id=com.spotify.music
play_store,2026-06-18T12:51:41+00:00,love Spotify but could be annoying some time,5,https://play.google.com/store/apps/details?id=com.spotify.music
play_store,2026-06-18T12:48:16+00:00,wow very nice 🙂,5,https://play.google.com/store/apps/details?id=com.spotify.music
play_store,2026-06-18T12:46:15+00:00,very nice Spotify,5,https://play.google.com/store/apps/details?id=com.spotify.music
play_store,2026-06-18T12:45:19+00:00,dailyyyyyy,5,https://play.google.com/store/apps/details?id=com.spotify.music
play_store,2026-06-18T12:44:36+00:00,"I don't have premium but I get alot of ads, I get 2-4 adds after one song. I get the same ads over and over. But it's still a great app for listening to music on, there's plenty of podcasts to listen to, you can even make your own playlists and add any song to it! Still an amazing app!",4,https://play.google.com/store/apps/details?id=com.spotify.music
play_store,2026-06-18T12:43:52+00:00,Funtastic app,5,https://play.google.com/store/apps/details?id=com.spotify.music
play_store,2026-06-18T12:43:32+00:00,Experience is good,5,https://play.google.com/store/apps/details?id=com.spotify.music
play_store,2026-06-18T12:40:14+00:00,...still listening and enjoying 😉,5,https://play.google.com/store/apps/details?id=com.spotify.music
play_store,2026-06-18T12:37:18+00:00,"Would seriously love to give this 4 stars. Sucks when it comes to unpaid sub but the student deal is really good. What I do have a problem with is the new Android widget. Tried taking it up with customer support but even when you ""message a representative"" nothing comes of it. I have a green loading screen of death and half the time when I try using it to get to the app it glitches out on me and takes me out of the app. Give me my old widget back!!!",2,https://play.google.com/store/apps/details?id=com.spotify.music
play_store,2026-06-18T12:35:00+00:00,ilike Spotify music,4,https://play.google.com/store/apps/details?id=com.spotify.music
play_store,2026-06-18T12:32:39+00:00,Great experience,4,https://play.google.com/store/apps/details?id=com.spotify.music
play_store,2026-06-18T12:31:41+00:00,it is a great and efficient kuyanyiwa kule app,5,https://play.google.com/store/apps/details?id=com.spotify.music
play_store,2026-06-18T12:29:51+00:00,clarity is guaranteed,5,https://play.google.com/store/apps/details?id=com.spotify.music
play_store,2026-06-18T12:29:48+00:00,"Absolutely HORRIBLE, what do you mean you have to pay to change songs? Stop being greedy spotify",1,https://play.google.com/store/apps/details?id=com.spotify.music
play_store,2026-06-18T12:28:43+00:00,so nicee,5,https://play.google.com/store/apps/details?id=com.spotify.music
play_store,2026-06-18T12:26:30+00:00,"it only sucks if you dont have premium benefits but from my experience this is peak, although there was this song I forgot about that I'll put in later and edit that you guys deleted and im just asking to bring it back because it wasnt rude or anything, it was quite popular and it was my gf favourite song",5,https://play.google.com/store/apps/details?id=com.spotify.music
play_store,2026-06-18T12:25:17+00:00,The recommendation system is fire 🔥🔥,5,https://play.google.com/store/apps/details?id=com.spotify.music
play_store,2026-06-18T12:23:44+00:00,A wonderful app for listening to music but the occasional ads are a bit letdown though and they are increasing becoming frequent....,4,https://play.google.com/store/apps/details?id=com.spotify.music
play_store,2026-06-18T12:22:18+00:00,sweet if you can subscribe,5,https://play.google.com/store/apps/details?id=com.spotify.music
play_store,2026-06-18T12:22:15+00:00,good music's,5,https://play.google.com/store/apps/details?id=com.spotify.music
play_store,2026-06-18T12:21:16+00:00,I would have given it five but it gives you random age checks,4,https://play.google.com/store/apps/details?id=com.spotify.music
play_store,2026-06-18T12:20:54+00:00,best music app but ads😡,4,https://play.google.com/store/apps/details?id=com.spotify.music
play_store,2026-06-18T12:20:15+00:00,>song DNA is gen good. > I genuinely hope this company gets bankrupt so it can get sold to someone who cares about its app functioning. please rich people i call out to u make sure they fail i cant take it anymore.,2,https://play.google.com/store/apps/details?id=com.spotify.music
play_store,2026-06-18T12:17:16+00:00,"Why change a running system?? ich hatte Jahre lang Spotify als 3x1 widget, es hat genau zwischen die anderen Apps auf meinen Homescreen gepasst. Was soll das, dass es jetzt mehr Platz braucht? Wie arrogant.",3,https://play.google.com/store/apps/details?id=com.spotify.music
play_store,2026-06-18T12:16:13+00:00,perfect aap for all music moods. MUST HAVE .,5,https://play.google.com/store/apps/details?id=com.spotify.music
play_store,2026-06-18T12:14:36+00:00,"Terrible for podcasts. Queues are flat out broken.you play episode 60 and it will add random episodes into the queue. then there is the AI slop, every playlist is full of it. Spotify hate artists.",1,https://play.google.com/store/apps/details?id=com.spotify.music
play_store,2026-06-18T12:14:00+00:00,"Spotify is an amazing app that I use every single day, all of it's features especially DJ are soo good. I love Spotify.",5,https://play.google.com/store/apps/details?id=com.spotify.music
play_store,2026-06-18T12:13:30+00:00,best platform,5,https://play.google.com/store/apps/details?id=com.spotify.music
play_store,2026-06-18T12:09:13+00:00,literally barely works off wifi anymore. horrible app. widgets are useless and inoperable,1,https://play.google.com/store/apps/details?id=com.spotify.music
play_store,2026-06-18T12:07:39+00:00,یعنی چی که پرمیوم نداشته باشی فقط میتونی پنج تا اهنگ در روز گوش بدی؟ جمع کنید بابا,1,https://play.google.com/store/apps/details?id=com.spotify.music
play_store,2026-06-18T12:05:54+00:00,nice app just too many ads 😞,5,https://play.google.com/store/apps/details?id=com.spotify.music
play_store,2026-06-18T12:05:27+00:00,so many ads in app for buy subscription,1,https://play.google.com/store/apps/details?id=com.spotify.music
play_store,2026-06-18T12:05:19+00:00,"App keeps failing to start, I've reinstalled and it fixes the issue but it's every 3 days at this point, starting to really grate on me as subscription price only goes up and so do the myriad of issues within the app. Surely more money means more staff to fix issues across devices",1,https://play.google.com/store/apps/details?id=com.spotify.music
play_store,2026-06-18T12:02:42+00:00,I love song and k-pop It helps me so much to listen to my fav songs and this app is very nice I love it.form Tysm Spotify <3😱,5,https://play.google.com/store/apps/details?id=com.spotify.music
play_store,2026-06-18T12:00:56+00:00,"przez ostatnie parę tygodni aplikacja częściej nie działa niż działa, przy próbie uruchomienia jest po prostu czarny ekran",1,https://play.google.com/store/apps/details?id=com.spotify.music
play_store,2026-06-18T11:59:27+00:00,Gud,5,https://play.google.com/store/apps/details?id=com.spotify.music
play_store,2026-06-18T11:53:13+00:00,"Why force a change from a working widget to one that is not working half the time, uses up more space and has fewer functionalities?",1,https://play.google.com/store/apps/details?id=com.spotify.music
play_store,2026-06-18T11:48:43+00:00,excellent app for me 💯💯💯💯💯💯💯💯💯💯💯💯💯💯💯💯💯💯💯💯💯💯💯💯,5,https://play.google.com/store/apps/details?id=com.spotify.music
play_store,2026-06-18T11:48:41+00:00,this song is so good 💯,5,https://play.google.com/store/apps/details?id=com.spotify.music
play_store,2026-06-18T11:46:38+00:00,It is a completely useless app and it has fewer songs and more ads. add dekhu rat bhar or gana chale jhat bhar 🤬,1,https://play.google.com/store/apps/details?id=com.spotify.music
