source,date,text,rating,url
play_store,2026-06-17T15:09:08+00:00,"its easy to hear streaming music,,",5,https://play.google.com/store/apps/details?id=com.spotify.music
play_store,2026-06-17T15:03:10+00:00,this is very and spofity premium is the best i does not see,5,https://play.google.com/store/apps/details?id=com.spotify.music
play_store,2026-06-17T14:54:43+00:00,when trying to pay for the premium am having difficulties in finding my school 😔 since it isn't there can you correct that,4,https://play.google.com/store/apps/details?id=com.spotify.music
play_store,2026-06-17T14:50:08+00:00,I absolutely love Spotify!! They even give you time to pay in these hard times. I will never switch. I will be paying Friday by the way 😆😆. Great music and app even books and podcasts. Thanks Spotify!,5,https://play.google.com/store/apps/details?id=com.spotify.music
play_store,2026-06-17T14:46:38+00:00,cest superb,5,https://play.google.com/store/apps/details?id=com.spotify.music
play_store,2026-06-17T14:45:19+00:00,"good music but I feel like everything needs premium. if you get this app do these setting's click on your profile, go to settings and privacy, play back, turn on gapless playback, cross fate on 6s, turn off volume normalizer.",3,https://play.google.com/store/apps/details?id=com.spotify.music
play_store,2026-06-17T14:45:03+00:00,"saat ini, saya sudah jarang beli spotify premium karena tidak mendapatkan tawaran 3 bulan cuma 49 ribu dan sekarang akun gratisan cuma 5 lagu aja udah dianggap overplayed🤬. dan juga tolong spotify perbaiki sistem shuffle nya juga karena shuffle nya ngebosenin atau gak sesuai sama genre lagu yang dipilih.",1,https://play.google.com/store/apps/details?id=com.spotify.music
play_store,2026-06-17T14:42:13+00:00,"Every time I close the app after listening, the next time I open it the app isn't showing ANYTHING, only my last played song. Even if I'm clicking on 'MY LIBRARY', nothings happening.. Really poor updates.",2,https://play.google.com/store/apps/details?id=com.spotify.music
play_store,2026-06-17T14:36:43+00:00,Not all songs are available in every country. The free version has advertisements. It requires internet to use. Offline listening needs a premium subscription,1,https://play.google.com/store/apps/details?id=com.spotify.music
play_store,2026-06-17T14:36:42+00:00,"Ostatnimi czasy Spotify zabrał mi widget na ekranie głównym. Mały 4x1, ale chcąc promować nową niewymiarową wersję (4x2) stara, mobilna przestała działać. nie mam miejsca na ekranie głównym na nowy duży widget. liczę że stary, mały widget 4x1 będzie znów działać, a do tego czasu przechodzę na Tidal, oferują lepszą usługę w lepszej cenie. Myślałem że to był główny problem ale ostatnio jest tylko gorzej i gorzej. Spotify sam pauzuje odtwarzanie bez żadnego powodu. Dałbym 0 gwiazdek gdybym mógł...",1,https://play.google.com/store/apps/details?id=com.spotify.music
play_store,2026-06-17T14:33:01+00:00,"good but i got ads the second i press on a song and some songs are not on here , other than that , the off platform playing is good especially for writing while focusing on the music",3,https://play.google.com/store/apps/details?id=com.spotify.music
play_store,2026-06-17T14:32:53+00:00,mast app he,5,https://play.google.com/store/apps/details?id=com.spotify.music
play_store,2026-06-17T14:29:57+00:00,so most beautiful song,5,https://play.google.com/store/apps/details?id=com.spotify.music
play_store,2026-06-17T14:29:47+00:00,nice but so many ads,4,https://play.google.com/store/apps/details?id=com.spotify.music
play_store,2026-06-17T14:28:51+00:00,its so gooddd,5,https://play.google.com/store/apps/details?id=com.spotify.music
play_store,2026-06-17T14:27:38+00:00,Great experience.,5,https://play.google.com/store/apps/details?id=com.spotify.music
play_store,2026-06-17T14:23:30+00:00,🫶🏻,5,https://play.google.com/store/apps/details?id=com.spotify.music
play_store,2026-06-17T14:19:12+00:00,Too many ads while using this app and after some scrolling some songs we hadn't any choice to choose a particular song and it's part. this worst what about that people whose not able or didn't want to buy premium.,1,https://play.google.com/store/apps/details?id=com.spotify.music
play_store,2026-06-17T14:18:18+00:00,Shocking Ads in Premium. I keep getting ads even though I have premium subscription,1,https://play.google.com/store/apps/details?id=com.spotify.music
play_store,2026-06-17T14:16:30+00:00,bed app,1,https://play.google.com/store/apps/details?id=com.spotify.music
play_store,2026-06-17T14:14:12+00:00,Ads are annoying.,1,https://play.google.com/store/apps/details?id=com.spotify.music
play_store,2026-06-17T14:13:33+00:00,Spotify great app,5,https://play.google.com/store/apps/details?id=com.spotify.music
play_store,2026-06-17T14:12:14+00:00,Spotify Connect can't seem to be disabled (the toggle in settings changes nothing) and is constantly causing playback interruptions when I try to use the PC app.,1,https://play.google.com/store/apps/details?id=com.spotify.music
play_store,2026-06-17T14:11:33+00:00,"I've been using this app from 2020 and till now, it says ""uninterrupted music for the next 30 minutes"" but the ad pops up after every single song, don't make money by making people fool....I'm really very disappointed by all these... maybe gotta uninstall this app",1,https://play.google.com/store/apps/details?id=com.spotify.music
play_store,2026-06-17T14:07:43+00:00,amazing playlist,5,https://play.google.com/store/apps/details?id=com.spotify.music
play_store,2026-06-17T14:00:32+00:00,the Spotify giveing me exact song at the exact time so thank you for that,5,https://play.google.com/store/apps/details?id=com.spotify.music
play_store,2026-06-17T13:58:49+00:00,i expect this app to be greedy but it was really good for pistening free,5,https://play.google.com/store/apps/details?id=com.spotify.music
play_store,2026-06-17T13:53:10+00:00,life is music,5,https://play.google.com/store/apps/details?id=com.spotify.music
play_store,2026-06-17T13:48:01+00:00,❣️,5,https://play.google.com/store/apps/details?id=com.spotify.music
play_store,2026-06-17T13:47:37+00:00,yah bahut achcha hai aur ismein free mein gane sunane milte Hain,5,https://play.google.com/store/apps/details?id=com.spotify.music
play_store,2026-06-17T13:45:56+00:00,"I love this music app, I can discover bunch and music and have fun with sharing playlist , even the cheapest premium plans is enough to stop ads interrupting my music, the only minus two star experience is that , it drains my Samsung watch 4 battery abnormally fast if I hear it from the watch even when offline , so please , optimize watch version of the app on play store, make it more battery efficient",3,https://play.google.com/store/apps/details?id=com.spotify.music
play_store,2026-06-17T13:43:36+00:00,"worst app, thousand ads for each and every song!.",1,https://play.google.com/store/apps/details?id=com.spotify.music
play_store,2026-06-17T13:37:33+00:00,I like the app but when I click a song it doesn't play the song I want,1,https://play.google.com/store/apps/details?id=com.spotify.music
play_store,2026-06-17T13:35:43+00:00,okay wa,3,https://play.google.com/store/apps/details?id=com.spotify.music
play_store,2026-06-17T13:29:34+00:00,I pay for a premium membership but then it limits the amount of time I can listen to audiobooks to 15 hours. I received an email suggesting that I buy more hours- this feels a bit scammy that my premium membership doesn't allow me to access unlimited audio book listening. Stop making access so difficult and treating educational content as a profit making mechanism when you already charge a fee that is being paid !,1,https://play.google.com/store/apps/details?id=com.spotify.music
play_store,2026-06-17T13:28:41+00:00,New widget is terrible. Give us back the old one.,2,https://play.google.com/store/apps/details?id=com.spotify.music
play_store,2026-06-17T13:25:50+00:00,very good and nice app and so best app 👌 and app is good and so nice 😀,5,https://play.google.com/store/apps/details?id=com.spotify.music
play_store,2026-06-17T13:25:24+00:00,I like Spotify but I don't know why it stops playing after opening another app. that's wrong and it has being happening several times. it suppose to continue playing even after I have watched a video,5,https://play.google.com/store/apps/details?id=com.spotify.music
play_store,2026-06-17T13:23:16+00:00,"Great app, easy to use",5,https://play.google.com/store/apps/details?id=com.spotify.music
play_store,2026-06-17T13:22:46+00:00,"very good quality. shame with ads for free, unlike deezer",5,https://play.google.com/store/apps/details?id=com.spotify.music
play_store,2026-06-17T13:20:05+00:00,Why the gatekeeping??? I find it absolutely insane that I can't use Spotify premium without mobile data or wifi. What's the point of paying a subscription and downloading music if it's still unavailable for me without a data subscription???,3,https://play.google.com/store/apps/details?id=com.spotify.music
play_store,2026-06-17T13:17:46+00:00,jst suprbb😍,5,https://play.google.com/store/apps/details?id=com.spotify.music
play_store,2026-06-17T13:13:49+00:00,"Very slow and laggy UI. When quickly scrolling through playlists, FPS drops to 1-2. Changing the view oftentimes takes a full second, even when all the data is already loaded (opening an album or a song, showing lyrics etc.).",3,https://play.google.com/store/apps/details?id=com.spotify.music
play_store,2026-06-17T13:11:56+00:00,10 outta 10.,5,https://play.google.com/store/apps/details?id=com.spotify.music
play_store,2026-06-17T13:07:50+00:00,As a user of this I realise that with proper or good work comes with good songs and I enjoy free song and i.m thankful for this one because I can play song without downloading the song I listen too,3,https://play.google.com/store/apps/details?id=com.spotify.music
play_store,2026-06-17T13:03:46+00:00,Best. Better than Apple music,5,https://play.google.com/store/apps/details?id=com.spotify.music
play_store,2026-06-17T13:01:55+00:00,I love this app!,5,https://play.google.com/store/apps/details?id=com.spotify.music
play_store,2026-06-17T13:01:44+00:00,I love Spotify!!!!!,5,https://play.google.com/store/apps/details?id=com.spotify.music
play_store,2026-06-17T12:56:25+00:00,"the new widget is awful, go back to the old one please",3,https://play.google.com/store/apps/details?id=com.spotify.music
play_store,2026-06-17T12:51:23+00:00,Enjoying the experience,5,https://play.google.com/store/apps/details?id=com.spotify.music
play_store,2026-06-17T12:49:33+00:00,it is best app but adds make disturbens in between listing music,4,https://play.google.com/store/apps/details?id=com.spotify.music
play_store,2026-06-17T12:47:32+00:00,"The best, though it doesn't certain jams",4,https://play.google.com/store/apps/details?id=com.spotify.music
play_store,2026-06-17T12:47:24+00:00,Totally reliable. Great value.,5,https://play.google.com/store/apps/details?id=com.spotify.music
play_store,2026-06-17T12:42:55+00:00,the best music app I have it shows the lyrics and wy phone did get a little warmer but it's okay 👍🏻,5,https://play.google.com/store/apps/details?id=com.spotify.music
play_store,2026-06-17T12:38:19+00:00,continuous adds...we can only hear songs for few hrs a day...like they are literally forcing all the users to buy premium,2,https://play.google.com/store/apps/details?id=com.spotify.music
play_store,2026-06-17T12:36:36+00:00,yee boiii,5,https://play.google.com/store/apps/details?id=com.spotify.music
play_store,2026-06-17T12:34:39+00:00,"can't even open it on my phone sometimes. it's not internet issues as I can still use other apps - like I'm doing right now. I get a black screen and nothing else. even after multiple reloads. all these apps are now buggy AF. then when it actually opens, the audio cuts out. there's no point paying premium if you can't actually use the thing you're paying for.",1,https://play.google.com/store/apps/details?id=com.spotify.music
play_store,2026-06-17T12:32:25+00:00,opensource,5,https://play.google.com/store/apps/details?id=com.spotify.music
play_store,2026-06-17T12:32:00+00:00,"Spotify continues to dominate as the ultimate music and audio platform in 2026. Whether I’m discovering new artists, building playlists for every mood, listening to podcasts, or enjoying audiobooks, it delivers an unbeatable personalized experience that keeps me coming back every day.",5,https://play.google.com/store/apps/details?id=com.spotify.music
play_store,2026-06-17T12:31:53+00:00,Greedy weirdos.,1,https://play.google.com/store/apps/details?id=com.spotify.music
play_store,2026-06-17T12:31:37+00:00,Very enjoyable,5,https://play.google.com/store/apps/details?id=com.spotify.music
play_store,2026-06-17T12:29:20+00:00,best for listening music,5,https://play.google.com/store/apps/details?id=com.spotify.music
play_store,2026-06-17T12:23:50+00:00,the sound is Soo good experience best but add are troublemaker,4,https://play.google.com/store/apps/details?id=com.spotify.music
play_store,2026-06-17T12:22:12+00:00,one of the best music streaming 😃,5,https://play.google.com/store/apps/details?id=com.spotify.music
play_store,2026-06-17T12:21:46+00:00,have been using the app for more than a year now. the app now does not load and I have to reinstall the app everyday,1,https://play.google.com/store/apps/details?id=com.spotify.music
play_store,2026-06-17T12:20:18+00:00,too much adds,1,https://play.google.com/store/apps/details?id=com.spotify.music
play_store,2026-06-17T12:19:06+00:00,I don't want to hear about this app or service that's predatory with the music industry.,1,https://play.google.com/store/apps/details?id=com.spotify.music
play_store,2026-06-17T12:18:02+00:00,They deducted my money even after disbanding my Spotify subscription. And they won't refund me back my money.,1,https://play.google.com/store/apps/details?id=com.spotify.music
play_store,2026-06-17T12:16:47+00:00,i enjoy listening music..,5,https://play.google.com/store/apps/details?id=com.spotify.music
play_store,2026-06-17T12:16:20+00:00,"The message i received when I tried to update 👇👇 Can't install Spotify: Music and Podcasts Try again, and if it still doesn't work, see common ways to fix the problem",1,https://play.google.com/store/apps/details?id=com.spotify.music
play_store,2026-06-17T12:14:15+00:00,"time to time it gets updated and then so many ads and now you can't even skip the song you don't want to listen, cannot listen to the searched song so frustrating",1,https://play.google.com/store/apps/details?id=com.spotify.music
play_store,2026-06-17T12:09:07+00:00,"premium always asks , I don't care about ads but it always asks if it's better to buy a youtube premium we can even watch movie, videos, and ad free music. in background, I gave it 1 star because of sportify good choice of song selection .",1,https://play.google.com/store/apps/details?id=com.spotify.music
play_store,2026-06-17T12:05:16+00:00,best songs 🎵 ♥,5,https://play.google.com/store/apps/details?id=com.spotify.music
play_store,2026-06-17T12:02:16+00:00,The ad is too much and it's long,2,https://play.google.com/store/apps/details?id=com.spotify.music
play_store,2026-06-17T11:58:23+00:00,very very very very nice app,5,https://play.google.com/store/apps/details?id=com.spotify.music
play_store,2026-06-17T11:58:14+00:00,probably can't live without music anymore,5,https://play.google.com/store/apps/details?id=com.spotify.music
play_store,2026-06-17T11:56:14+00:00,best bole dengan lagu,5,https://play.google.com/store/apps/details?id=com.spotify.music
play_store,2026-06-17T11:55:32+00:00,Always the ads are about premium stuff and you can't play songs for long time. the album doesn't come in order. even the ads are too many at same time like their time duration is longer as well as the number. Except that the songs are good. Few songs have lyrical mistakes,3,https://play.google.com/store/apps/details?id=com.spotify.music
play_store,2026-06-17T11:55:16+00:00,too much ad,1,https://play.google.com/store/apps/details?id=com.spotify.music
play_store,2026-06-17T11:54:32+00:00,this is not coming sound,1,https://play.google.com/store/apps/details?id=com.spotify.music
play_store,2026-06-17T11:53:42+00:00,😎 cool app,5,https://play.google.com/store/apps/details?id=com.spotify.music
play_store,2026-06-17T11:49:53+00:00,Ang Ganda nyaaaaaàa,5,https://play.google.com/store/apps/details?id=com.spotify.music
play_store,2026-06-17T11:49:14+00:00,loving it,4,https://play.google.com/store/apps/details?id=com.spotify.music
play_store,2026-06-17T11:47:27+00:00,it's my everything everyday,5,https://play.google.com/store/apps/details?id=com.spotify.music
play_store,2026-06-17T11:44:15+00:00,"this app sucks it wont even let me listen to music anymore AT ALL like when i search up a song and try to play it, it says i discovered a premium feature. this is literally horrible",1,https://play.google.com/store/apps/details?id=com.spotify.music
play_store,2026-06-17T11:43:42+00:00,best app ever🤩,5,https://play.google.com/store/apps/details?id=com.spotify.music
play_store,2026-06-17T11:42:38+00:00,It's the best app for free music and it also plays the song when it's offline.Just love it♥️♥️♥️,5,https://play.google.com/store/apps/details?id=com.spotify.music
play_store,2026-06-17T11:39:26+00:00,Lots of music. Works well. Love the AI DJ.,5,https://play.google.com/store/apps/details?id=com.spotify.music
play_store,2026-06-17T11:37:11+00:00,had for 7 years and is thw best app for learning to music (premium it absolutely amazing worth the money),5,https://play.google.com/store/apps/details?id=com.spotify.music
play_store,2026-06-17T11:31:41+00:00,Nice switch up on genres.,4,https://play.google.com/store/apps/details?id=com.spotify.music
play_store,2026-06-17T11:28:04+00:00,it's good but the glitching that happens to the app to me gets annoying it locks me in a black screen and I gtt Uninstall every time,3,https://play.google.com/store/apps/details?id=com.spotify.music
play_store,2026-06-17T11:27:15+00:00,Bestttttt apppp,5,https://play.google.com/store/apps/details?id=com.spotify.music
play_store,2026-06-17T11:23:23+00:00,wonderful experience,5,https://play.google.com/store/apps/details?id=com.spotify.music
play_store,2026-06-17T11:20:47+00:00,"Great experience as usual, Playlists are quite good",5,https://play.google.com/store/apps/details?id=com.spotify.music
play_store,2026-06-17T11:11:23+00:00,all u need is premium version to listen....,1,https://play.google.com/store/apps/details?id=com.spotify.music
play_store,2026-06-17T11:10:14+00:00,I subscribed for a full control of my listening using my google account the money was deducted but the subscription did not happen so what is the meaning of that,1,https://play.google.com/store/apps/details?id=com.spotify.music
play_store,2026-06-17T11:08:53+00:00,I love this app so much because I can listen to my favorite songs with my phone off and there isn't any adds I have to wait on,5,https://play.google.com/store/apps/details?id=com.spotify.music
play_store,2026-06-17T11:05:57+00:00,THANK YOU FOR THE RESHUFFLE BUTTON. OVERDUE. but whys my search bar so slow? :(,3,https://play.google.com/store/apps/details?id=com.spotify.music
play_store,2026-06-17T11:05:36+00:00,always the best experience since day 1,5,https://play.google.com/store/apps/details?id=com.spotify.music
play_store,2026-06-17T11:03:28+00:00,"I didnt see any problems with it, I really enjoy the songs and that this app has lyrics for most songs too. This music app great! ^^",5,https://play.google.com/store/apps/details?id=com.spotify.music
play_store,2026-06-17T10:56:55+00:00,too many ads bro 😭😭😭,1,https://play.google.com/store/apps/details?id=com.spotify.music
play_store,2026-06-17T10:48:11+00:00,Good songe,4,https://play.google.com/store/apps/details?id=com.spotify.music
play_store,2026-06-17T10:47:32+00:00,the quality and sound is the best better than YouTube music and I've had premium way longer than it said but times when I try and go on to Spotify it doesn't show up all the stuff it's just a blank screen,4,https://play.google.com/store/apps/details?id=com.spotify.music
play_store,2026-06-17T10:45:48+00:00,Pure soul,5,https://play.google.com/store/apps/details?id=com.spotify.music
play_store,2026-06-17T10:41:53+00:00,lots of music,5,https://play.google.com/store/apps/details?id=com.spotify.music
play_store,2026-06-17T10:41:42+00:00,"As a loyal Spotify user for years, this app has easily become the ultimate soundtrack to my daily routine. The absolute best part is its incredibly smart algorithm features like Discover Weekly always introduce me to amazing new tracks that perfectly match my vibe. I also love Spotify Connect, which lets me easily switch my music from my phone to my home speakers with just one tap.",5,https://play.google.com/store/apps/details?id=com.spotify.music
play_store,2026-06-17T10:38:08+00:00,I pay for premium but as of a few days ago I can't queue anything. The support website also kinda sucks and didn't help me at all and there's not real help or support inside of the app itself. It also doesn't give me the option to reorganize queue.,3,https://play.google.com/store/apps/details?id=com.spotify.music
play_store,2026-06-17T10:33:49+00:00,ads ads ads all day,1,https://play.google.com/store/apps/details?id=com.spotify.music
play_store,2026-06-17T10:33:10+00:00,"prefer the previous version of how it looked when I went to add a song to a playlist. I'd also like if I could have certain songs excluded from my Spotify Wrapped. Every year, mine is just songs I go to sleep to. 😭 shuffle could also be better. Love everything else, though!",3,https://play.google.com/store/apps/details?id=com.spotify.music
play_store,2026-06-17T10:29:56+00:00,subscription ke baad bhi app chalte chalte bich me abruptly band ho jata hai,2,https://play.google.com/store/apps/details?id=com.spotify.music
play_store,2026-06-17T10:29:27+00:00,"Spotify is useless, very useless after downloading my offline songs Spotify cleaned my downloads without permission no after downloading twice wasting almost 10 gigs of data just to download music on Spotify most of the songs that I can't play them offline. I really wish I can give them a zero star",1,https://play.google.com/store/apps/details?id=com.spotify.music
play_store,2026-06-17T10:26:13+00:00,nice ji,5,https://play.google.com/store/apps/details?id=com.spotify.music
play_store,2026-06-17T10:24:56+00:00,Too much ads 😕.... If you don't have a premium plan you can't listen a single song without ads....usually after 2 or 3 songs you will listen 2 or 3 ads back to back. Worst experience,1,https://play.google.com/store/apps/details?id=com.spotify.music
play_store,2026-06-17T10:24:27+00:00,very better than other apps,5,https://play.google.com/store/apps/details?id=com.spotify.music
play_store,2026-06-17T10:21:40+00:00,very anbatabale,5,https://play.google.com/store/apps/details?id=com.spotify.music
play_store,2026-06-17T10:20:09+00:00,"The updated widget is completely broken, and didn't update the old one in any useful way.",2,https://play.google.com/store/apps/details?id=com.spotify.music
play_store,2026-06-17T10:11:54+00:00,"Good I'd recommend spotify to alot of people, it's even easy to use",5,https://play.google.com/store/apps/details?id=com.spotify.music
play_store,2026-06-17T10:11:09+00:00,this app work 💪 very well 😀 as long you have wifi 😀,5,https://play.google.com/store/apps/details?id=com.spotify.music
play_store,2026-06-17T10:10:17+00:00,app miskin,1,https://play.google.com/store/apps/details?id=com.spotify.music
play_store,2026-06-17T10:10:00+00:00,Love the mix function.,5,https://play.google.com/store/apps/details?id=com.spotify.music
play_store,2026-06-17T10:09:57+00:00,"over the 11 years I've used Spotify it has never been more unoptimized, sluggish and weighed down by awful useless features. I dont want ai playlists or mixes I want to stream music quickly and latley Spotify hasn't been doing so much in terms of that to be real",1,https://play.google.com/store/apps/details?id=com.spotify.music
play_store,2026-06-17T10:09:23+00:00,"I used enjoy the free version, but now the ads are too frequent and too many. looks like greedy bastard syndrome to me!",2,https://play.google.com/store/apps/details?id=com.spotify.music
play_store,2026-06-17T10:04:20+00:00,Spotify has given me the best experience for the past two years especially with premium,5,https://play.google.com/store/apps/details?id=com.spotify.music
play_store,2026-06-17T10:01:17+00:00,I don't know Spotify is a cuz. How much charge blood through quality of music is great and then I just kind of like this extra device. I can turn my tablet and do like the dual Bluetooth multi point.,3,https://play.google.com/store/apps/details?id=com.spotify.music
play_store,2026-06-17T09:58:29+00:00,very good. I like to listen to it while working. various genres available,5,https://play.google.com/store/apps/details?id=com.spotify.music
play_store,2026-06-17T09:57:56+00:00,I love it because it show me Yara Yara phonk 🤣🤣🤣🤣🤤🤤🤤🤤🤤🤤,5,https://play.google.com/store/apps/details?id=com.spotify.music
play_store,2026-06-17T09:49:56+00:00,absolutely ascending,5,https://play.google.com/store/apps/details?id=com.spotify.music
play_store,2026-06-17T09:49:10+00:00,"what's with the ""update your Spotify widget""????????????",3,https://play.google.com/store/apps/details?id=com.spotify.music
